{
  "aspect": "11-adventure",
  "type": "generic",
  "trip": "china-vietnam-2026",
  "title": "Adventure",
  "slide_title": "ADVENTURE",
  "intro": "Scenic and nature-focused adventure calibrated to relaxed-cultural profile. Both travelers in excellent physical condition. Great Wall (Day 3) is the China anchor. September Vietnam: warm water (~28°C), calm inshore at Mỹ Khê; typhoon watch on open-ocean activities. No extreme sports.",
  "tables": [
    {
      "caption": "Adventure Calendar",
      "columns": ["Day", "Activity", "Notes"],
      "rows": [
        ["Day 2", "Jingshan Hill (30 min)", "Light; 300 steps; best Forbidden City panorama post-visit"],
        ["Day 3", "Great Wall Mutianyu + toboggan", "Main China anchor — 4–6 km ridge walk, 2–3 hrs; toboggan from Tower 6"],
        ["Day 5", "Kunming Lake rowboat", "Gentle — 1–2 hrs, ~¥100/hr among lotus flowers"],
        ["Day 9", "Marble Mountains + beach + SUP", "Full activity day; caves 9–11 AM before heat"],
        ["Day 10", "Hội An walking", "Cultural but physical"],
        ["Day 11", "Son Trà Peninsula + optional snorkeling", "Nature walk; langurs 7:30–10 AM; snorkeling weather-dependent"],
        ["Day 12", "My Son sanctuary walk", "Early AM; 1.5–2 hrs; uneven jungle terrain"],
        ["Day 13", "Final beach morning", "Pure relaxation"]
      ]
    },
    {
      "caption": "China — Beijing Adventures",
      "columns": ["Activity", "Difficulty", "Details"],
      "rows": [
        ["Great Wall (Mutianyu)", "Moderate", "4–6 km ridge; ~200 m elevation; uneven steps; wild wall beyond Tower 20; good shoes required"],
        ["Jingshan Hill", "Easy", "88 m hill, 300 steps; 30 min round trip; summit panorama of Forbidden City"],
        ["Summer Palace Rowboat", "Leisurely", "Kunming Lake; 1–2 hrs; pagodas from water; peaceful"]
      ]
    },
    {
      "caption": "Vietnam — Water & Land",
      "columns": ["Activity", "Viability", "Details"],
      "rows": [
        ["Mỹ Khê Beach swim (Days 9, 13)", "Excellent", "~28°C water; mild surf; resort loungers provided"],
        ["Stand-Up Paddleboarding", "Good", "Resort rental (Hyatt, Fusion Maia); morning flat conditions; ~$15–20/hr or included"],
        ["Cham Islands Snorkeling", "Marginal", "50–60% clear conditions in Sept; check weather 48 hrs; ~$35–50/person; weather-dependent bonus"],
        ["Son Trà Peninsula", "Easy–Moderate", "Rainforest walk; Lady Buddha; douc langurs 7:30–10 AM; 2–3 hrs"],
        ["Marble Mountains", "Easy", "Stairs + caverns; cable car available; Huyen Khong + Van Thong caves; 1.5–2 hrs"],
        ["My Son Sanctuary", "Easy", "Flat mostly; muddy after rain; 7:30 AM opening"]
      ]
    },
    {
      "caption": "Cross-Border Gear",
      "columns": ["Item", "Bring?", "Notes"],
      "rows": [
        ["Hiking/walking shoes", "Yes", "Mutianyu grip; Marble Mountains uneven steps"],
        ["Sandals/flip-flops", "Yes", "Temple visits, beach, resort"],
        ["Swimwear (2 sets)", "Yes", "Daily beach use in Vietnam"],
        ["Light rain jacket", "Yes", "Monsoon season; doubles as layer"],
        ["Underwater camera", "Yes", "GoPro or waterproof case for beach/snorkeling"],
        ["Trekking poles / snorkel gear", "No", "Not needed; snorkel gear rentable at Cham Islands"]
      ]
    }
  ],
  "bullets": [
    {
      "heading": "Great Wall Gear & Tips",
      "items": [
        "Comfortable walking shoes (NOT sandals); sunscreen; water",
        "Wall vendors charge ¥25 for water at top",
        "Toboggan: 580 m descent from Tower 6, ~3 min — exhilarating but not extreme",
        "Day 3 is not a border day — CLEAR"
      ]
    },
    {
      "heading": "Cham Islands Snorkeling",
      "items": [
        "18 km offshore; speedboat ~45 min; Cham Island Diving Center (PADI certified)",
        "Book 1 day ahead, not in advance; full-day trip with lunch",
        "Plan Day 11 afternoon after fitting; treat as weather-dependent bonus",
        "Operators cancel if sea conditions deteriorate"
      ]
    },
    {
      "heading": "Operator Vetting",
      "items": [
        "Snorkeling: ask PADI certification, boat capacity, life jackets",
        "Water activities: daily equipment inspection; cancellation/refund policy",
        "Son Trà: vehicle insurance; private guide preferred",
        "Book through resort concierge or TripAdvisor-rated operators — avoid street touts"
      ]
    }
  ],
  "callouts": [
    { "status": "warn", "text": "Cham Islands snorkeling: September end of good season — check weather 48 hrs before; visibility varies" },
    { "status": "warn", "text": "All outdoor adventure before 11 AM or in protected cave/water environments (heat deal-breaker)" },
    { "status": "pass", "text": "Border crossing days (6, 8) have NO adventure activities" },
    { "status": "pass", "text": "Recovery built in: Days 1, 6, 8, 13 are soft/rest days — no adventure fatigue risk" }
  ]
}
